{
  "schema": "trecap_phase2_frozen_release_manifest_v1",
  "release_name": "phase2_revJ_dev_architecture_v69",
  "release_version": "0.1.0-dev.1",
  "spec_revision": "core_rev_j",
  "telemetry_revision": "telemetry_rev_g",
  "created_utc": "2026-07-24T06:10:00Z",
  "generator_versions": {
    "golden_model": "trecap_golden_0.1.0",
    "coefficient_generator": "phase2_generators_revision_j",
    "vector_generator": "phase2_generators_revision_j",
    "artifact_checker": "artifact_check.py",
    "quality_bounds_generator": "make_quality_bounds.py"
  },
  "manifest_hashes": {
    "core_config_sha256": "bcecf65648099883ae02def17de56ab4140a611434bf93de314c542d9b14438a",
    "coeff_manifest_sha256": "aecaf4b858532dd0c42c5d14a95970fc2bdd8a3ec26555b568566c122ed312b9",
    "test_vectors_sha256": "c66f67adc30342d279fc551ba017fcd78ad806fb2a9a163845b3036bf3f9eb4b",
    "quality_bounds_sha256": "437d43b8bf1a23992b64725cdb87e24d3b55d5edc147d8c8b4c3782235b3c41c",
    "artifact_index_sha256": "ee47a57ec97e0893bad9dc61a612d594c7b02ccc9c6c0aed74dace587c466009"
  },
  "artifacts": [
    {
      "path": "artifacts/coefficients/coeff_manifest.json",
      "role": "manifest",
      "artifact_type": "json",
      "sha256": "aecaf4b858532dd0c42c5d14a95970fc2bdd8a3ec26555b568566c122ed312b9",
      "canonicalized": false,
      "required": true,
      "producer": "trecap-golden tools",
      "schema_ref": "spec/schemas/coeff_manifest.schema.json",
      "content_contract": "json_schema_validated"
    },
    {
      "path": "artifacts/coefficients/twiddle_im.memh",
      "role": "coefficient",
      "artifact_type": "memh",
      "sha256": "d8b9c42a442e0dcaace24ec76ae28b41c29d7ad4df6e43aed1da0c1df818d1a0",
      "canonicalized": true,
      "required": true,
      "producer": "trecap-golden tools",
      "rows": 256,
      "width_bits": 17,
      "signed": true,
      "canonical_sha256": "d8b9c42a442e0dcaace24ec76ae28b41c29d7ad4df6e43aed1da0c1df818d1a0",
      "content_contract": "fixed_width_lowercase_hex_lf"
    },
    {
      "path": "artifacts/coefficients/twiddle_inv_im.memh",
      "role": "coefficient",
      "artifact_type": "memh",
      "sha256": "2ffc1ad332cb48307073a57c8dc5367c95a33210e1f4216f1b96091695f12d20",
      "canonicalized": true,
      "required": true,
      "producer": "trecap-golden tools",
      "rows": 256,
      "width_bits": 17,
      "signed": true,
      "canonical_sha256": "2ffc1ad332cb48307073a57c8dc5367c95a33210e1f4216f1b96091695f12d20",
      "content_contract": "fixed_width_lowercase_hex_lf"
    },
    {
      "path": "artifacts/coefficients/twiddle_inv_re.memh",
      "role": "coefficient",
      "artifact_type": "memh",
      "sha256": "84094f5e7e6bbdde3e4f458e1e5386af2d3c440f6154bcd8fbd415e521377944",
      "canonicalized": true,
      "required": true,
      "producer": "trecap-golden tools",
      "rows": 256,
      "width_bits": 17,
      "signed": true,
      "canonical_sha256": "84094f5e7e6bbdde3e4f458e1e5386af2d3c440f6154bcd8fbd415e521377944",
      "content_contract": "fixed_width_lowercase_hex_lf"
    },
    {
      "path": "artifacts/coefficients/twiddle_re.memh",
      "role": "coefficient",
      "artifact_type": "memh",
      "sha256": "84094f5e7e6bbdde3e4f458e1e5386af2d3c440f6154bcd8fbd415e521377944",
      "canonicalized": true,
      "required": true,
      "producer": "trecap-golden tools",
      "rows": 256,
      "width_bits": 17,
      "signed": true,
      "canonical_sha256": "84094f5e7e6bbdde3e4f458e1e5386af2d3c440f6154bcd8fbd415e521377944",
      "content_contract": "fixed_width_lowercase_hex_lf"
    },
    {
      "path": "artifacts/coefficients/window_qw.memh",
      "role": "coefficient",
      "artifact_type": "memh",
      "sha256": "05bcfd74bea5fe075b56a5b83c9db53ea73c4b0f6d6f45348eda0a14cf41c4ed",
      "canonicalized": true,
      "required": true,
      "producer": "trecap-golden tools",
      "rows": 256,
      "width_bits": 16,
      "signed": false,
      "canonical_sha256": "05bcfd74bea5fe075b56a5b83c9db53ea73c4b0f6d6f45348eda0a14cf41c4ed",
      "content_contract": "fixed_width_lowercase_hex_lf"
    },
    {
      "path": "artifacts/manifests/artifact_index.json",
      "role": "manifest",
      "artifact_type": "json",
      "sha256": "ee47a57ec97e0893bad9dc61a612d594c7b02ccc9c6c0aed74dace587c466009",
      "canonicalized": false,
      "required": true,
      "producer": "trecap-golden tools",
      "schema_ref": "spec/schemas/artifact_index.schema.json",
      "content_contract": "json_schema_validated"
    },
    {
      "path": "artifacts/manifests/core_config_snapshot.json",
      "role": "manifest",
      "artifact_type": "json",
      "sha256": "bcecf65648099883ae02def17de56ab4140a611434bf93de314c542d9b14438a",
      "canonicalized": false,
      "required": true,
      "producer": "trecap-golden tools",
      "schema_ref": "spec/schemas/core_config.schema.json",
      "content_contract": "json_schema_validated"
    },
    {
      "path": "artifacts/manifests/quality_bounds.json",
      "role": "manifest",
      "artifact_type": "json",
      "sha256": "437d43b8bf1a23992b64725cdb87e24d3b55d5edc147d8c8b4c3782235b3c41c",
      "canonicalized": false,
      "required": true,
      "producer": "trecap-golden tools",
      "schema_ref": "spec/schemas/quality_bounds.schema.json",
      "content_contract": "json_schema_validated"
    },
    {
      "path": "artifacts/reference_outputs/impulse_Ns1024_thr0/frame_stats.csv",
      "role": "statistics",
      "artifact_type": "csv",
      "sha256": "ec1008be4adf7ba62dd77b2b4ded760ca06b5607d4b9b483a76dec58eb5ce45b",
      "canonicalized": true,
      "required": true,
      "producer": "trecap-golden tools",
      "vector_name": "impulse_Ns1024_thr0",
      "rows": 9,
      "content_contract": "lf_csv_exact_header"
    },
    {
      "path": "artifacts/reference_outputs/impulse_Ns1024_thr0/metrics.json",
      "role": "statistics",
      "artifact_type": "json",
      "sha256": "8d48d182da205f5e189bdcb87e4197aaa4989501b9ddc2f647ff1df45f8f0036",
      "canonicalized": false,
      "required": true,
      "producer": "trecap-golden tools",
      "vector_name": "impulse_Ns1024_thr0",
      "schema_ref": "spec/schemas/metrics.schema.json",
      "content_contract": "json_schema_validated"
    },
    {
      "path": "artifacts/reference_outputs/impulse_Ns1024_thr0/y_out.memh",
      "role": "golden_output",
      "artifact_type": "memh",
      "sha256": "607bbb9f04d53e20d121aa1b35e140c73ed9eb00260ed22cb38981c4c3eef5d3",
      "canonicalized": true,
      "required": true,
      "producer": "trecap-golden tools",
      "vector_name": "impulse_Ns1024_thr0",
      "rows": 1536,
      "width_bits": 12,
      "signed": true,
      "canonical_sha256": "607bbb9f04d53e20d121aa1b35e140c73ed9eb00260ed22cb38981c4c3eef5d3",
      "content_contract": "fixed_width_lowercase_hex_lf"
    },
    {
      "path": "artifacts/reference_outputs/near_threshold_multitone_Ns1024_thr64/bin_stats.csv",
      "role": "statistics",
      "artifact_type": "csv",
      "sha256": "b78691a1aa9dda2eae098dd75a7b673461dd385e7689694c0e53cd3d7e2e7822",
      "canonicalized": true,
      "required": true,
      "producer": "trecap-golden tools",
      "vector_name": "near_threshold_multitone_Ns1024_thr64",
      "rows": 1161,
      "content_contract": "lf_csv_exact_header"
    },
    {
      "path": "artifacts/reference_outputs/near_threshold_multitone_Ns1024_thr64/frame_stats.csv",
      "role": "statistics",
      "artifact_type": "csv",
      "sha256": "b4c185906337a44f5f040fb9e20ea95b956e3fce49d1c4920d954557a9e013cd",
      "canonicalized": true,
      "required": true,
      "producer": "trecap-golden tools",
      "vector_name": "near_threshold_multitone_Ns1024_thr64",
      "rows": 9,
      "content_contract": "lf_csv_exact_header"
    },
    {
      "path": "artifacts/reference_outputs/near_threshold_multitone_Ns1024_thr64/metrics.json",
      "role": "statistics",
      "artifact_type": "json",
      "sha256": "164999f8bf2d56032e729cf4a53be8f8fc828aee4dbe55f51b9eeb6418193c0e",
      "canonicalized": false,
      "required": true,
      "producer": "trecap-golden tools",
      "vector_name": "near_threshold_multitone_Ns1024_thr64",
      "schema_ref": "spec/schemas/metrics.schema.json",
      "content_contract": "json_schema_validated"
    },
    {
      "path": "artifacts/reference_outputs/near_threshold_multitone_Ns1024_thr64/y_out.memh",
      "role": "golden_output",
      "artifact_type": "memh",
      "sha256": "718212b1cbb8fca5a60206b6a9d5b39363ae0cee8945ca792b670c035fd34117",
      "canonicalized": true,
      "required": true,
      "producer": "trecap-golden tools",
      "vector_name": "near_threshold_multitone_Ns1024_thr64",
      "rows": 1536,
      "width_bits": 12,
      "signed": true,
      "canonical_sha256": "718212b1cbb8fca5a60206b6a9d5b39363ae0cee8945ca792b670c035fd34117",
      "content_contract": "fixed_width_lowercase_hex_lf"
    },
    {
      "path": "artifacts/reference_outputs/zero_Ns4096_thr0/frame_stats.csv",
      "role": "statistics",
      "artifact_type": "csv",
      "sha256": "b7dc0625f008147432bee9e0d99d10bd37a377e6ac500adf620d8bd4f0c4016a",
      "canonicalized": true,
      "required": true,
      "producer": "trecap-golden tools",
      "vector_name": "zero_Ns4096_thr0",
      "rows": 33,
      "content_contract": "lf_csv_exact_header"
    },
    {
      "path": "artifacts/reference_outputs/zero_Ns4096_thr0/metrics.json",
      "role": "statistics",
      "artifact_type": "json",
      "sha256": "f64c91c23bcbd2bf0883e8e036dd448dadac961c743e5bab5c92ccbe4988674b",
      "canonicalized": false,
      "required": true,
      "producer": "trecap-golden tools",
      "vector_name": "zero_Ns4096_thr0",
      "schema_ref": "spec/schemas/metrics.schema.json",
      "content_contract": "json_schema_validated"
    },
    {
      "path": "artifacts/reference_outputs/zero_Ns4096_thr0/y_out.memh",